{
  "$schema": "https://json-schema.org/draft/2020-12/schema",
  "title": "verification-result",
  "description": "The verifier stage's verdict. The coordinator routes the workflow on status and retry_recommended, so both are required.",
  "type": "object",
  "required": ["status", "retry_recommended"],
  "properties": {
    "status": {
      "type": "string",
      "description": "The verdict the coordinator routes on.",
      "enum": ["passed", "failed"]
    },
    "blocking_issues": {
      "type": "array",
      "description": "Evidence-backed findings that block acceptance.",
      "items": {
        "type": "object",
        "required": ["severity", "issue", "location", "required_behavior"],
        "properties": {
          "severity": {
            "type": "string",
            "description": "How badly the finding blocks acceptance.",
            "enum": ["high", "medium", "low"]
          },
          "issue": {
            "type": "string",
            "description": "What failed."
          },
          "location": {
            "type": "string",
            "description": "File or area the finding applies to."
          },
          "required_behavior": {
            "type": "string",
            "description": "What must be true for the finding to clear."
          }
        }
      }
    },
    "unverified": {
      "type": "array",
      "description": "What could not be verified, and why.",
      "items": { "type": "string" }
    },
    "retry_recommended": {
      "type": "boolean",
      "description": "Whether the coordinator should route a bounded retry."
    },
    "retry_target": {
      "type": "string",
      "description": "The retry category the next attempt is routed on, named exactly as the workflow's retry_routing table declares it. The coordinator requires it whenever retry_recommended is true, and escalates on a missing or unrecognised one rather than falling back to a default route. It is not in required because this schema cannot express that condition: the validator subset has no if/then and no dependentRequired, so 'required when retry_recommended is true' is inexpressible, and requiring it unconditionally would force a routing key onto a passing verification that routes nowhere."
    },
    "guidance_outcomes": {
      "type": "array",
      "description": "One object per entry of the retry guidance in force for the attempt this verdict judges: every current_focus focus and every preserve_behavior string of it, each echoed verbatim and answered. Every entry must be accounted for, so a retry that regressed behaviour it was told to preserve fails normally rather than reading as defective guidance. The coordinator compares the echoed set against the guidance in force it recorded when the retry was routed, and escalates on any mismatch — missing, extra, misquoted or absent altogether — rather than assuming what silence meant. When every entry is accounted for and none is unmet, a failed verdict is a contradiction: the guidance sanctioned the outcome it is being failed for, and the verifier runs again in place to rewrite guidance that does not authorize what it will fail, or to fail the work on the criterion it actually failed. It is optional because a first verification has no guidance in force to answer.",
      "items": {
        "type": "object",
        "required": ["guidance"],
        "properties": {
          "guidance": {
            "type": "string",
            "description": "One entry of the guidance in force, echoed verbatim: a current_focus focus or a preserve_behavior string, character for character as the guidance carries it. The coordinator compares strings and reads none of them as language, so a paraphrase is a mismatch."
          },
          "unmet": {
            "type": "string",
            "description": "Why this entry was not met. Its presence is the signal that the retry did not meet the entry, and its content is the reason. It is one string rather than a boolean with a sibling reason for the same limitation retry_target and unfinishable_by_retry record: this validator subset has no if/then and no dependentRequired, so 'reason required when the flag is true' is inexpressible, and a flag with a sibling reason has a state where the flag is set and the reason is missing, while presence-as-signal has none. Judge the entry against the satisfied_when written when the entry was written, not against a condition arrived at now. Absent means the entry was met."
          }
        }
      }
    },
    "correctable_findings": {
      "type": "array",
      "description": "Findings you judge correct but too small to fail the run, that one stage can fix mechanically. Its presence is the signal that a correction pass should run: there is no separate key saying whether this field means anything, for the same limitation retry_target, unfinishable_by_retry and guidance_outcomes.unmet already record above — this validator subset has no if/then and no dependentRequired, so a flag with a sibling payload has a state where the flag is set and the payload is missing, while presence-as-signal has none. A correctable finding is a correction to words alone — a comment, a docstring, a schema description, a document — and never to behaviour: nothing a correction pass changes may alter what any test asserts about the system, and the suite must pass unchanged across a pass. A finding whose repair would change behaviour is a repairable finding where one stage can make it in one file, a blocking issue where it matters more than that, and belongs in unverified where it cannot be settled — not here. It is read only on a passing verdict, because a failed verdict already routes and the correction travels in the retry guidance it already writes. It is optional because almost every verdict has no such finding.",
      "items": {
        "type": "object",
        "required": ["path", "location", "finding", "correction", "category"],
        "properties": {
          "path": {
            "type": "string",
            "description": "The repository-relative file the words to correct are in. Naming it is what lets the stage the pass enters at change that file: at the documenter's post-stage checks the exempt list is the story's own grants plus the path of every finding in the current pass record, so a finding grants its stage the one file it names, for that pass alone. An edit to any file no finding named stays governed by the revert check. This is why a correctable finding without a path fails schema validation — the pass would run with no scope to change the words in. The value is one file and never a directory: a value ending in a slash is directory-shaped and is refused by the coordinator before any pass is routed, stopping the run naming the path. The grant is bounded to the pass that made it — it applies while that pass's record is live, and ends when a retry moves the attempt or a pass of the other kind routes."
          },
          "location": {
            "type": "string",
            "description": "Where the wording is: the file, and the symbol, section or line within it that carries the words to correct. Where the finding was raised from one the pre-stage inspection routed to this story, name that finding's slug here, so the accounting counts it as acted on rather than filing it as a brief."
          },
          "finding": {
            "type": "string",
            "description": "What is wrong with the words as they stand."
          },
          "correction": {
            "type": "string",
            "description": "What the words should say instead, specifically enough that a stage can make the edit without re-deciding what the finding meant."
          },
          "category": {
            "type": "string",
            "description": "The retry category that owns the prose being corrected, spelled exactly as the workflow's retry_routing table declares it. The field introduces no new vocabulary and it does not choose where the pass goes: the entry stage comes off the workflow's own correction_pass declaration, so a pass enters at the same stage whatever category a finding carries. What the category still does is name the kind of prose, and it is still required and still checked against that table — one the workflow does not declare escalates the run naming the categories it does, with the same strictness an unrecognised retry_target gets."
          }
        }
      }
    },
    "repairable_findings": {
      "type": "array",
      "description": "Findings you judge correct but too small to fail the run, whose fix is not to the words alone and belongs to the stage that owns the file each names. A fix spanning files is one finding per file, each naming the same slug in location and carrying its own category, and the coordinator routes them as one pass. This is the third route between a correctable finding and a blocking issue: a correctable finding enters at the declared correction stage and is bounded to prose, and a blocking issue fails the verdict and spends a retry, while a repairable finding re-enters the workflow at the stage that owns it — the coordinator looks each finding's category up in this stage's retry_routing table exactly as it looks up a failed verdict's retry_target, enters at the earliest stage in workflow order among the resolved stages, and runs forward to verification again. Nothing a retry spends is spent: no retry is consumed, no attempt is archived, and the passing verdict that carried it stands. Its presence is the signal that a repair pass should run, for the same limitation retry_target, unfinishable_by_retry and correctable_findings record: this validator subset has no if/then and no dependentRequired, so presence-as-signal is the only shape with no state where the signal is set and the payload is missing. It is read only on a passing verdict, and only after the clean-clone check on that verdict has passed, because a repair may change behaviour and is therefore built on a verified tree; a failed verdict already routes and the correction travels in the retry guidance it writes. A category the workflow's retry_routing table does not define escalates the run naming the categories it does, with the strictness an unrecognised retry_target gets. It is optional because almost every verdict has no such finding, and it is bounded by the repair_pass budget the workflow declares.",
      "items": {
        "type": "object",
        "required": ["path", "location", "finding", "correction", "category"],
        "properties": {
          "path": {
            "type": "string",
            "description": "The repository-relative file the fix is in. Naming it is the grant: the stage the finding's category resolves to is granted this one file for that pass alone, on the same exempt list the ownership check and the revert check read, and an edit to any other governed file stays governed. A finding names one file; a fix spanning files is one finding per file, each naming the same slug in location, and the coordinator routes them as one pass entering at the earliest of the stages their categories resolve to. The file may lie outside the story's declared scope where the finding carries scope_extension, and may never be under a path the execution rules block for every stage, because a grant cannot reach one: such a finding is refused before the pass is routed and accounted as declined with that bound as its reason. The value is one file and never a directory: a value ending in a slash is directory-shaped and is refused by the coordinator before the clean-clone check runs and before any pass is routed, stopping the run naming the path. The grant is bounded to the pass that made it — it applies while that pass's record is live, and ends when a retry moves the attempt or a pass of the other kind routes."
          },
          "location": {
            "type": "string",
            "description": "Where the defect is: the file, and the symbol, section or line within it. Where the finding was raised from one the pre-stage inspection routed to this story, name that finding's slug here, so the accounting counts it as acted on rather than filing it as a brief."
          },
          "finding": {
            "type": "string",
            "description": "What is wrong as it stands."
          },
          "correction": {
            "type": "string",
            "description": "What the fix is, specifically enough that the owning stage can make it without re-deciding what the finding meant. The stage entered is told the finding and the correction and nothing else."
          },
          "category": {
            "type": "string",
            "description": "The retry category that owns the fix, spelled exactly as the workflow's retry_routing table declares it. Unlike a correctable finding's category, this one chooses where the pass goes: it is resolved through that table to the stage that owns the file, and one the workflow does not declare escalates the run naming the categories it does."
          },
          "scope_extension": {
            "type": "string",
            "description": "Optional. The reason the file named in path is reached although it lies outside the story's declared scope: the rule the story changed, and the line in this file that states or consumes it — the test is that the file already says something the story made false, not that the fix would be convenient there. Its presence is what asks the coordinator for an extension, on the presence-as-signal terms the fields beside it record. The coordinator grants an extension for the pass alone, announcing each grant in the events log and on the console, and refuses one that crosses any of three bounds, naming the bound: the path is under a path the execution rules block for every stage; a restriction on the stage the category resolves to governs the path, so a tester's extension cannot reach the implementation; or a scope.do_not_modify entry carrying a reason names the path or a directory it is under. A refused finding is dropped from the pass, accounted as declined with the bound as its reason and filed as a brief at the run's completion, while the rest of the pass is routed and the run continues; a refusal never escalates the run. A finding carrying none is granted, routed and recorded exactly as before this field existed. The approved story artifact is not rewritten: an extension is a run-time grant recorded on top of it."
          }
        }
      }
    },
    "declined_findings": {
      "type": "array",
      "description": "The findings routed to this story — the pre-stage inspection's findings about the story's own change — that the verifier declined to correct or repair, each with the reason. The default is that a routed finding is corrected or repaired unless there is a reason not to, and this is where the reason goes: an entry names the routed finding's slug and says why it was left. Its presence is the signal, on the terms retry_target, unfinishable_by_retry, correctable_findings and repairable_findings already record: this validator subset has no if/then and no dependentRequired, so presence-as-signal is the only shape with no state where the signal is set and the payload is missing. Nothing routes on it. It changes nothing about what is filed: the coordinator's accounting after the verdict still files, at the run's completion, every routed finding whose slug no blocking issue, correctable finding or repairable finding names, whether or not an entry here declines it — what an entry here changes is that the accounting records the reason beside the slug rather than recording that none was given. It is optional because most verdicts decline nothing, and a verdict carrying none is accounted exactly as before, with every routed finding the verdict left recorded as declined without a reason.",
      "items": {
        "type": "object",
        "required": ["slug", "reason"],
        "properties": {
          "slug": {
            "type": "string",
            "description": "The slug of the routed finding being declined, as the inspection findings carry it. Matched by the accounting as the whole string, so it is the slug alone — not the file beside it, not a location — and an entry whose slug differs from the finding's by any character is recorded as though no reason was given."
          },
          "reason": {
            "type": "string",
            "description": "Why the finding was not corrected or repaired: too small to be worth a pass, or wrong on the evidence. A fix that is only out of the story's declared scope is not a reason: such a finding is recorded as repairable with scope_extension instead, and the coordinator's own refusal of an extension that crosses a bound is recorded by the accounting with the bound as its reason. Written for the reader of the run who meets the accounting and wants to know why a finding reached the backlog instead of being fixed here."
          }
        }
      }
    },
    "unfinishable_by_retry": {
      "type": "string",
      "description": "The verifier's judgement that no number of retries closes the gap between what remains and what an attempt delivers, together with the split it recommends between this story and a follow-on. Its presence on a failed verdict ends the run in escalation at that verification, before the retry count is compared to the ceiling: the budget is left unspent and the retry count untouched, because the judgement is that spending them would not finish the work. Its content is both the judgement and the escalation's recorded reason, so the developer reads the verifier's own words rather than a reason the coordinator composed. It is one string rather than a boolean with a sibling reason for the same limitation retry_target records above: the validator subset has no if/then and no dependentRequired, so 'reason required when the flag is true' is inexpressible, and presence-as-signal leaves no state where the signal is set and the reason is missing. It is optional because almost every verdict has no such judgement to make, and it is read only on a failed verdict — a passing verification routes nowhere, so nothing there could act on it."
    }
  }
}
