{
  "status": "failed",
  "retry_recommended": true,
  "retry_target": "validation",
  "blocking_issues": [
    {
      "severity": "high",
      "issue": "The conversion is still incomplete: 3 modules converted, 17 declared as unconverted input readers. The retry converted the two modules the previous finding named -- tests/test_self_routing_retry.py (WORKFLOW = conftest.build_workflow(...) at line 140, four stages assembled from arguments, every name derived from it) and tests/test_retry_routing.py (build_workflow at line 98) -- and both now drive real runs against conftest.materialize_workflow roots. That part is done and verified. But the story's task 'Convert each input reader to a workflow it builds for itself' and technical_plan.likely_file_changes name roughly twenty-four tester modules, and the remaining seventeen were not converted; they were instead recorded in a new set WORKFLOW_INPUT_READERS_AWAITING_CONVERSION (tests/test_baseline_honesty.py:2335-2353), which the module's own comment calls 'the remaining work'. Declaring the debt is honest and the both-directions equality assertion (test_the_modules_reading_the_shipped_workflow_are_exactly_the_classified_ones) makes it survive, but it is not the conversion, and it leaves acceptance criterion 7 unsatisfiable: PERMITTED_LIVE_ARTIFACT_READERS still carries seventeen modules whose shipped-workflow read the suite itself classifies as an input.",
      "location": "tests/test_baseline_honesty.py:2335-2353 and the seventeen modules it names",
      "required_behavior": "Each module in WORKFLOW_INPUT_READERS_AWAITING_CONVERSION is converted to a workflow it builds through conftest.build_workflow / materialize_workflow, keeping every assertion's subject and strength, with each displaced configuration assertion moved into tests/test_shipped_workflow_is_valid.py -- so the set empties and PERMITTED_LIVE_ARTIFACT_READERS names only modules whose reads are subjects."
    },
    {
      "severity": "high",
      "issue": "Eight stated reasons on PERMITTED_LIVE_ARTIFACT_READERS assert that the shipped workflow IS the subject of a module's assertions, while WORKFLOW_INPUT_READERS_AWAITING_CONVERSION in the same file declares that same module's workflow read an input. The two structures contradict each other and nothing asserts they agree. Verified by printing both structures: test_attempt_archiving.py ('the stage list it archives per attempt is the deployed one'), test_documenter_before_verification.py ('its subject is the shipped stage order'), test_escalation_resume.py ('what --stage accepts is a claim about this deployment's stage list'), test_execution_history.py ('the event record ... for the stages it deploys'), test_required_output_freshness.py ('the outputs this deployment declares its stages must produce'), test_resume_guard.py ('the stage list this deployment defines'), test_shared_baseline_resolution.py ('the workflow it drives a run under is this repository's'), test_stage_baseline.py ('the baseline captured before each deployed stage'). Exactly one of the seventeen -- test_stage_output_ownership.py -- had its reason rewritten to disclose the awaiting-conversion status, which shows the correction was understood and then applied to one module rather than to the family. This is the unfalsifiability the previous finding named, now split across two structures that disagree: reading the reason against the module (the check verification_requirements names) yields the opposite answer to reading the classification.",
      "location": "tests/test_baseline_honesty.py:2176-2274",
      "required_behavior": "Either the module is converted, or its reason stops claiming the workflow as a subject and names only the non-workflow read that keeps it on the list, in the form test_stage_output_ownership.py already uses. Additionally, an assertion should hold the two structures to agreement, so a reason claiming workflow-subjecthood for a module in WORKFLOW_INPUT_READERS_AWAITING_CONVERSION fails rather than sitting unnoticed."
    },
    {
      "severity": "low",
      "issue": "The story's 'after' wall-clock runtime is still absent from every run artifact after a retry that named the gap explicitly. test-results.json records 2488 passed / 0 failed and no duration; no other artifact in .harness/runs/story-048/ carries one. The documentation report states the gap rather than concealing it. Severity is low rather than medium only because this verification supplies the measurement: the verifier ran `.venv/bin/python -m pytest tests/ -q` under `time` on the current tree and observed 2488 passed in 474.10s, 7:54.33 total wall clock -- against the before figure of 2449 tests, 474.49s / 7:54.84 wall at dcda75d. The conversion recovered no measurable runtime, which is now on the record here.",
      "location": ".harness/runs/story-048/test-results.json",
      "required_behavior": "The after figure is recorded in a run artifact a later reader finds, beside the before figure, so the story's final criterion is met by the run rather than by the verifier."
    }
  ],
  "unverified": [
    "Whether each of the seventeen unconverted modules is genuinely an input reader rather than a subject reader was not independently re-derived module by module; the classification was read against the eight contradicting reasons above, which is what produced the second finding, but the remaining nine were taken as stated.",
    "Mutation-sensitivity of every individual converted assertion was not exercised one assertion at a time. Evidence relied on instead: the converted modules guard against vacuity explicitly (tests/test_self_routing_retry.py:253-257 asserts a budgeted stage and a budget-less stage both exist, :1432 and :1582 assert non-emptiness before reading contents), their assertions drive real coordinator runs against materialized roots rather than inspecting a definition, and tests/test_shipped_workflow_is_valid.py:652 drives a built definition through story_coordinator.run_story to a zero exit."
  ]
}
